{
  "$id": "https://raw.githubusercontent.com/yairm210/Unciv/refs/heads/master/docs/Modders/schemas/Specialists.schema.json",
  "$schema": "http://json-schema.org/draft-07/schema#",
  "title": "Specialists",
  "description": "A list of specialist types, including their stats and great person points.",
  "type": "array",
  "items": {
    "type": "object",
    "properties": {
      "name": {
        "type": "string",
        "title": "Name",
        "description": "The name of the Specialist.",
        "examples": ["Scientist", "Merchant", "Artist", "Engineer"]
      },
      "production": {
        "type": "number",
        "description": "Amount of Production provided by this specialist per turn.",
        "default": 0,
        "title": "Production"
      },
      "food": {
        "type": "number",
        "description": "Amount of Food provided by this specialist per turn.",
        "default": 0,
        "title": "Food"
      },
      "gold": {
        "type": "number",
        "description": "Amount of Gold provided by this specialist per turn.",
        "default": 0,
        "title": "Gold"
      },
      "science": {
        "type": "number",
        "description": "Amount of Science provided by this specialist per turn.",
        "default": 0,
        "title": "Science"
      },
      "culture": {
        "type": "number",
        "description": "Amount of Culture provided by this specialist per turn.",
        "default": 0,
        "title": "Culture"
      },
      "happiness": {
        "type": "number",
        "description": "Amount of Happiness provided by this specialist per turn.",
        "default": 0,
        "title": "Happiness"
      },
      "authority": {
        "type": "number",
        "description": "Amount of Authority provided by this specialist per turn.",
        "default": 0,
        "title": "Authority"
      },
      "color": {
        "$ref": "refs/Color.schema.json",
        "description": "The color of the image for this specialist."
      },
      "greatPersonPoints": {
        "title": "Great Person Points",
        "type": "object",
        "description": "Great person points generated by this specialist per turn. Valid keys are the names of units (Great Scientist, Warrior, etc.)",
        "additionalProperties": {
          "type": "integer"
        }
      },
      "uniques": { "$ref": "refs/Uniques.schema.json" }
    },
    "required": ["name", "color"],
    "additionalProperties": false
  }
}
