[
	{
		"name":"Researcher",
		"science":3,
		"greatPersonPoints": {"Elite Scientist":3},
		"color": [0,0,255]
	},
	{
		"name":"Trader",
		"gold":3,
		"greatPersonPoints": {"Elite Trader":3},
		"color": [255,215,0]
	},
	{
		"name":"Artisan",
		"culture":2,
		"greatPersonPoints": {"Elite Artisan":3},
		"color": [160,32,240]
	},
	{
		"name":"Mechanic",
		"production":2,
		"greatPersonPoints": {"Elite Engineer":3},
		"color": [139,69,19]
	}
]
